"","FALSE","Google","5","2026-04-02","いつも選ぶのは地の利もさることながら、このホテルの安定と安心です。","","","いつも選ぶのは地の利もさることながら、このホテルの安定と安心です。","","","NORIAKI MASUDA","","FALSE","Google","5","2026-04-02","いつも選ぶのは地の利もさることながら、このホテルの安定と安心です。","","","いつも選ぶのは地の利もさることながら、このホテルの安定と安心です。","","","NORIAKI MASUDA"
"","FALSE","Booking.com","9","2026-04-01","","Very convenient location, close to main station with many restaurants and shops close by. Staff were friendly and service was  efficient. Rooms and beds are a good size, clean and comfortable. Will happily stay here again.","Breakfast was ok, however there wasn't any cereal or toast on offer when we stayed.","","非常に便利な立地で、主要駅に近く、周辺には多くのレストランやショップがあります。スタッフは親切で、サービスも効率的でした。部屋とベッドは十分な広さで、清潔で快適です。またぜひ利用したいと思います。","朝食はまあまあでしたが、私たちが滞在した時はシリアルやトーストは提供されていませんでした。","Natalie","","FALSE","Booking.com","9","2026-04-01","","Very convenient location, close to main station with many restaurants and shops close by. Staff were friendly and service was  efficient. Rooms and beds are a good size, clean and comfortable. Will happily stay here again.","Breakfast was ok, however there wasn't any cereal or toast on offer when we stayed.","","非常に便利な立地で、主要駅に近く、周辺には多くのレストランやショップがあります。スタッフは親切で、サービスも効率的でした。部屋とベッドは十分な広さで、清潔で快適です。またぜひ利用したいと思います。","朝食はまあまあでしたが、私たちが滞在した時はシリアルやトーストは提供されていませんでした。","Natalie"
"","FALSE","Booking.com","8","2026-04-01","","La posizione dell'hotel è strategica, è vicina alla stazione JR di Kinshicho, metro e fermata dei bus. La camera è confortevole, la pulizia ottima. La possibilità di avere prodotti skincare, spazzolino, pinza e prodotti per il bagno è molto comoda.","stanza un pò piccola","","ホテルはJR錦糸町駅、地下鉄、バス停に近く、立地が非常に便利です。客室は快適で、清潔感にあふれています。スキンケア用品、歯ブラシ、トング、洗面用具などが備え付けられているのも大変助かります。","部屋が少し狭い","Melissa","","FALSE","Booking.com","8","2026-04-01","","La posizione dell'hotel è strategica, è vicina alla stazione JR di Kinshicho, metro e fermata dei bus. La camera è confortevole, la pulizia ottima. La possibilità di avere prodotti skincare, spazzolino, pinza e prodotti per il bagno è molto comoda.","stanza un pò piccola","","ホテルはJR錦糸町駅、地下鉄、バス停に近く、立地が非常に便利です。客室は快適で、清潔感にあふれています。スキンケア用品、歯ブラシ、トング、洗面用具などが備え付けられているのも大変助かります。","部屋が少し狭い","Melissa"
"","FALSE","Booking.com","10","2026-04-01","","綺麗","","","綺麗","","Toshinao","","FALSE","Booking.com","10","2026-04-01","","綺麗","","","綺麗","","Toshinao"
"","FALSE","Google","5","2026-04-01","3泊しました。駅から徒歩約8分で、周辺には24時間営業のスーパー（セイユ）をはじめ、たくさんの飲食店があります。パルコやドン・キホーテも近く、ショッピングにも便利です。総武線快速で成田空港へ直行できるので、滞在場所としては非常に良いです。  唯一の難点は、渋谷、原宿、表参道などへの移動が多い場合、少し時間がかかることです。それ以外は、とても満足しています。","","","3泊しました。駅から徒歩約8分で、周辺には24時間営業のスーパー（セイユ）をはじめ、たくさんの飲食店があります。パルコやドン・キホーテも近く、ショッピングにも便利です。総武線快速で成田空港へ直行できるので、滞在場所としては非常に良いです。  唯一の難点は、渋谷、原宿、表参道などへの移動が多い場合、少し時間がかかることです。それ以外は、とても満足しています。","","","easonlin323","","FALSE","Google","5","2026-04-01","3泊しました。駅から徒歩約8分で、周辺には24時間営業のスーパー（セイユ）をはじめ、たくさんの飲食店があります。パルコやドン・キホーテも近く、ショッピングにも便利です。総武線快速で成田空港へ直行できるので、滞在場所としては非常に良いです。  唯一の難点は、渋谷、原宿、表参道などへの移動が多い場合、少し時間がかかることです。それ以外は、とても満足しています。","","","3泊しました。駅から徒歩約8分で、周辺には24時間営業のスーパー（セイユ）をはじめ、たくさんの飲食店があります。パルコやドン・キホーテも近く、ショッピングにも便利です。総武線快速で成田空港へ直行できるので、滞在場所としては非常に良いです。  唯一の難点は、渋谷、原宿、表参道などへの移動が多い場合、少し時間がかかることです。それ以外は、とても満足しています。","","","easonlin323"
"","FALSE","Google","5","2026-04-01","在這邊住了三晚,距離車站大約8分鐘路程,附近可以吃的店家非常多,也有24H的商店(SEIYU),Parco跟唐吉軻德也不錯逛,並且總武線快速也能直達成田機場,其實是一個很不錯的住宿點  唯一可以說的缺點我想應該是若你的行程是在澀谷/原宿/表參到居多的話,車程會稍遠了些,除了這點之外我覺得都挺棒的","","","3泊しました。駅から徒歩約8分で、24時間営業のスーパー（セイユ）をはじめ、周辺にはたくさんの飲食店があります。パルコやドン・キホーテも近く、ショッピングにも便利です。総武線快速で成田空港へ直行できるので、滞在するにはとても良い場所です。唯一の難点は、渋谷、原宿、表参道などへの移動が多い場合、少し時間がかかることくらいでしょうか。それ以外は、とても満足しています。","","","easonlin323","","FALSE","Google","5","2026-04-01","在這邊住了三晚,距離車站大約8分鐘路程,附近可以吃的店家非常多,也有24H的商店(SEIYU),Parco跟唐吉軻德也不錯逛,並且總武線快速也能直達成田機場,其實是一個很不錯的住宿點  唯一可以說的缺點我想應該是若你的行程是在澀谷/原宿/表參到居多的話,車程會稍遠了些,除了這點之外我覺得都挺棒的","","","3泊しました。駅から徒歩約8分で、24時間営業のスーパー（セイユ）をはじめ、周辺にはたくさんの飲食店があります。パルコやドン・キホーテも近く、ショッピングにも便利です。総武線快速で成田空港へ直行できるので、滞在するにはとても良い場所です。唯一の難点は、渋谷、原宿、表参道などへの移動が多い場合、少し時間がかかることくらいでしょうか。それ以外は、とても満足しています。","","","easonlin323"
"","FALSE","Booking.com","10","2026-03-31","","地點方便，房間整潔，出水很大洗澡很舒適","沒有不滿意的地方","","立地が便利で、部屋は清潔で、水圧も強いので、シャワーがとても快適です。","不満な点は何もありません。","Chia","","","","","","","","","","","",""
"","FALSE","Booking.com","7","2026-03-31","","一樓大廳提供泡澡球、面膜，跟其他常見的備品，但沒有浴帽跟牙刷。","早餐還不錯吃，但品項不多而且每天一樣，連住很多天會吃到膩，自動鬆餅機很有趣","","1階のロビーにはバスボムやフェイスマスクなどの一般的なアメニティは用意されているが、シャワーキャップや歯ブラシはない。","朝食はまあまあだったが、種類が少なく、毎日同じものだったので、数日滞在すると飽きてしまうだろう。自動ワッフルメーカーはなかなか面白かった。","Chen","","","","","","","","","","","",""
"","FALSE","Booking.com","10","2026-03-31","","","","","","","Juan","","","","","","","","","","","",""
"","FALSE","Booking.com","9","2026-03-31","","","","","","","Andrew","","","","","","","","","","","",""
"","FALSE","楽天トラベル","4","2026-03-31","立地も駅近で良いですね。朝食は普通。ただ海外スタッフの方の日本語、マナーは素晴らしいものがありました。是非これからも頑張ってください。","","","立地も駅近で良いですね。朝食は普通。ただ海外スタッフの方の日本語、マナーは素晴らしいものがありました。是非これからも頑張ってください。","","","W220S55LKUNI","","","","","","","","","","","",""
"","FALSE","Booking.com","8","2026-03-30","","交通方便，附近也有很多超商及24小時的樂天超市","","","交通の便が良く、近隣には多くのコンビニエンスストアや24時間営業のロッテマートがあります。","","家儀","","","","","","","","","","","",""
"","FALSE","Trip.com","9","2026-03-30","整體感覺相當滿意，離車站近，步行5分鐘左右就到！","","","全体的にとても満足しています。駅からも近く、徒歩わずか5分ほどです！","","","ゲ‍ス‍ト","","","","","","","","","","","",""
"","FALSE","Trip.com","10","2026-03-30","設備上都還不錯，有翻新，服務人員的服務態度真的一百分。房間內很乾淨，空間算大，出水量很大，還可以協助寄存行李、收包裹，下次來還想入住這間","","","設備はどれも素晴らしく、部屋も改装されていました。スタッフのサービスも最高でした。部屋はとても清潔で広々としており、水圧も十分でした。荷物預かりや荷物の受け取りも手伝ってくれました。次回も必ずここに泊まりたいと思います。","","","ゲ‍ス‍ト","","","","","","","","","","","",""
"","FALSE","Trip.com","10","2026-03-30","駅近ですが、静かで快適でした。","","","駅近ですが、静かで快適でした。","","","ゲ‍ス‍ト","","","","","","","","","","","",""
"","FALSE","Google","4","2026-03-30","錦糸町駅から徒歩圏内の便利な立地にあるホテルです。","","","錦糸町駅から徒歩圏内の便利な立地にあるホテルです。","","","Shimla Diaries","","","","","","","","","","","",""
"","FALSE","Google","4","2026-03-30","Perfectly located hotel centrally located and walking distance to Kinshichō station","","","錦糸町駅から徒歩圏内の便利な立地にあるホテルです。","","","Shimla Diaries","","","","","","","","","","","",""
"","FALSE","Trip.com","10","2026-03-29","挺不錯的酒店👍","","","とても素敵なホテルですね👍","","","ゲ‍ス‍ト","","","","","","","","","","","",""
"","FALSE","Booking.com","8","2026-03-29","","部屋がきれいだった","ちょっと高い","","部屋がきれいだった","ちょっと高い","Rie","","","","","","","","","","","",""
"","FALSE","Booking.com","8","2026-03-29","","The staff in breakfast buffet were nice.  Since we were vegetarian, we couldn't take sweet potato mixed with meat.  We asked, they roasted few sweet potatoes for us and gave.       The room had all the basic needs, which was very useful.  The location was few hundred meters to the metro, 7/11 and few more marts around.","The room size was small for a family with kid(s), there was no room for keeping luggage also.  Vegetarian food options are very limited but can manage.","","朝食ビュッフェのスタッフは親切でした。私たちはベジタリアンだったので、肉入りのサツマイモは食べられませんでした。お願いしたところ、サツマイモを焼いて出してくれました。部屋には必要なものがすべて揃っていて、とても便利でした。立地も良く、地下鉄の駅やセブンイレブン、その他いくつかのスーパーマーケットまで数百メートルでした。","部屋は子供連れの家族には狭く、荷物を置くスペースもありませんでした。ベジタリアン向けの食事の選択肢は非常に限られていますが、何とか対応できます。","Pani","","","","","","","","","","","",""
"","FALSE","Trip.com","10","2026-03-27","服務很棒！房間內的紅酒、啤酒、餅乾、果汁全都免費，而且每天都補新的！！房間乾淨、整潔、有氛圍！體驗感超好👍👍👍","","","サービスは最高でした！部屋に用意されていたワイン、ビール、クッキー、ジュースはすべて無料で、毎日補充されていました！部屋は清潔で整頓されていて、雰囲気も素晴らしかったです！本当に素晴らしい体験でした！👍👍👍","","","ゲ‍ス‍ト","","","","","","","","","","","",""
"","FALSE","Trip.com","4","2026-03-27","有啲污糟，隔音好差","","","少し汚れていて、防音性も低い。","","","i‍l‍o‍v‍e‍f‍r‍i‍e‍d‍r‍i‍c‍e","","","","","","","","","","","",""
"","FALSE","Trip.com","10","2026-03-27","Very good and interesting location and the great view of the city","","","立地が非常に良く、街の眺めも素晴らしい。","","","A‍l‍e‍x‍e‍y‍ ‍P‍o‍l‍o‍v‍n‍i‍k‍o‍v","","","","","","","","","","","",""
"","FALSE","Booking.com","10","2026-03-27","","","","","","","佳萾","","","","","","","","","","","",""
"","FALSE","Booking.com","10","2026-03-27","","","","","","","Jade","","","","","","","","","","","",""
"","FALSE","Trip.com","10","2026-03-26","每次去日本都喜歡住這一家連鎖飯店，主要的原因就是飯店內床鋪寬度有150公分，不是一般的經濟雙人房那種140公分的床，就算兩個人睡也不會太擠，但缺點就是因為床鋪為正常尺寸，相對房間的空間就會較小。  本次住進錦糸町這家，優點是：1.入口處有迎賓飲料2離JR錦糸町車站不遠，附近很熱鬧，有吃的有逛的，還有24小時的超市 缺點是：訂非吸菸房，但靠近廁所位置有菸味","","","日本に行くときはいつもこのチェーンホテルに泊まるのが好きです。主な理由は、エコノミーダブルルームの一般的な140cm幅のベッドではなく、150cm幅のベッドがあるからです。2人でも窮屈さを感じずに快適に眠れます。ただし、欠点はベッドが標準サイズなので、部屋のスペースが比較的狭いことです。今回は錦糸町支店に泊まりました。利点は、1. 入口でウェルカムドリンクがあったこと、2. JR錦糸町駅から遠くなく、周辺には飲食店やショッピング施設、24時間営業のスーパーマーケットなどがあり賑やかであることでした。欠点は、禁煙室を予約したのに、トイレ付近でタバコの臭いがしたことです。","","","ゲ‍ス‍ト","","","","","","","","","","","",""
"","FALSE","Trip.com","10","2026-03-26","Good location, 5 minutes walk from Kinshicho Station.  No transfer needed from Narita Airport by train. Shopping centers, shops and restaurants are near by. Friendly staff.  Definitely will stay again.","","","錦糸町駅から徒歩5分という好立地。成田空港から電車で乗り換える必要もありません。ショッピングセンター、ショップ、レストランも近くにあります。スタッフも親切でした。間違いなくまた利用します。","","","ゲ‍ス‍ト","","","","","","","","","","","",""
"","FALSE","Trip.com","10","2026-03-26","Had a fantastic stay! The hotel is very nice, clean, and comfortable. The absolute best part is the location—it's right in the heart of everything and made exploring so easy. Highly recommend if you want to be close to the action!","","","素晴らしい滞在でした！ホテルはとても素敵で、清潔で快適でした。何より最高だったのは立地です。街の中心部に位置しているので、観光がとても楽でした。賑やかな場所に近いホテルをお探しの方には、ぜひおすすめします！","","","匿‍名‍ユ‍ー‍ザ‍ー","","","","","","","","","","","",""
"","FALSE","Booking.com","10","2026-03-26","","","","","","","Liyu","","","","","","","","","","","",""
"","FALSE","Trip.com","9","2026-03-26","出張の際はこちらに毎回泊まります。 こないだも今回も、時期的にすごく高かったのですが アップグレードして頂き快適な宿泊となりました。","","","出張の際はこちらに毎回泊まります。 こないだも今回も、時期的にすごく高かったのですが アップグレードして頂き快適な宿泊となりました。","","","み‍ゆ‍か","","","","","","","","","","","",""
"","FALSE","Google","5","2026-03-25","宿泊施設はとても清潔で快適でした。バスルームのアメニティは、階下のフロントデスクでセルフサービスで利用できました。部屋には荷物を置くのに十分なスペースがありました。電車とバスの駅にも非常に近く（徒歩5～7分）、毎日清掃が行われ、部屋にタバコの臭いもありませんでした。非常におすすめです！コストパフォーマンスも抜群です。","","","宿泊施設はとても清潔で快適でした。バスルームのアメニティは、階下のフロントデスクでセルフサービスで利用できました。部屋には荷物を置くのに十分なスペースがありました。電車とバスの駅にも非常に近く（徒歩5～7分）、毎日清掃が行われ、部屋にタバコの臭いもありませんでした。非常におすすめです！コストパフォーマンスも抜群です。","","","Muay Arandyarak","","","","","","","","","","","",""
"","FALSE","Trip.com","10","2026-03-25","真的是非常棒的飯店❤️ 我們住了5天 地理位置絕佳 走路就可以到錦系町車站 且有JR線、半藏門線 換乘交通非常方便 附近也有很多吃的餐廳、便利商店和24h超市 生活飲食非常便利  再來是房間內的環境 非常乾淨舒服溫馨 以東京住宿來說 房內的空間算蠻大的，而且還有浴缸 床頭還有窗戶，可以看外面的風景 電視還可以連接手機 沐浴用品也用的非常好 龍頭設備水壓非常的強，洗澡非常非常的舒服 水又大又熱的（瞬熱） 而且還可以一邊淋浴一邊放泡澡的水，兩者同時進行 超完美😍 還有提供除臭除菌的衣物噴霧和除濕機 超級貼心🫶🏻（愛死）  櫃檯人員也都很親切友善 退房很酷噢～ 可以用機器按ㄧ按退房👍  整體下來體驗真的非常舒服💕 已經決定下次再去東京旅遊都要住這了☺️ 大推薦給去東京旅遊找住宿的妳/你們哦^_^","","","ここは本当に素晴らしいホテルです！❤️ 5日間滞在しました。立地は最高で、錦糸町駅から徒歩圏内、JR線と半蔵門線にもアクセスでき、交通の便が非常に良いです。周辺にはレストラン、コンビニ、24時間営業のスーパーマーケットもたくさんあり、日常生活や食事にとても便利です。部屋自体もとても清潔で快適で居心地が良かったです。東京の宿泊施設としてはかなり広い部屋で、バスタブまでありました。ベッドの横には景色が見える窓があり、テレビは携帯電話に接続できました。アメニティも素晴らしく、蛇口の水圧が非常に強く、シャワーがとても快適でした。お湯はすぐに出て、量もたっぷりでした（瞬時に加熱！）。シャワーとバスタブを同時に使うこともできました。完璧です！😍 消臭・除菌の洗濯用スプレーと除湿機も用意されていて、とても気が利いていました！🫶🏻（とても気に入りました！）フロントのスタッフもとてもフレンドリーで親切でした。チェックアウトは簡単でした！機械でボタンを押すだけでチェックアウトできたんです！👍 全体的に、本当に素晴らしい体験でした！💕 次回東京に来るときも、またここに泊まることに決めました！☺️ 東京旅行で宿泊先を探している方には、ぜひおすすめします！^_^","","","A‍m‍y‍ ‍ ‍Ł‍î‍a‍o","","","","","","","","","","","",""
"","FALSE","Trip.com","7","2026-03-25","気持ちよく利用できました","","","気持ちよく利用できました","","","ゲ‍ス‍ト","","","","","","","","","","","",""
"","FALSE","Booking.com","10","2026-03-25","","La proximité avec la gare, Le petit déjeuner, L'accueil et la gentillesse du personnel","","","駅に近いこと、朝食、スタッフの温かい歓迎と親切さ","","Thomas","","","","","","","","","","","",""
"","FALSE","Google","5","2026-03-25","ที่พักสะอาดมาก สะดวกสบาย มี Bathroom amentiries ให้หยิบได้เองที่หน้า Front ด้านล่าง ห้องมีพื้นที่ให้วางกระเป๋าเดินทางได้พอสมควร ใกล้สถานนีรถไฟกับรถบัสมาก เดิน5-7นาที มีแม่บ้านทำความสะอาดทุกวัน ไม่มีกลิ่นบุหรี่ในห้องด้วย แนะนำเลยค่ะ ดีงามมาก ราคาไม่แรงด้วย","","","宿泊施設はとても清潔で快適でした。バスルームのアメニティは、階下のフロントデスクでセルフサービスで利用できました。部屋には荷物を置くのに十分なスペースがありました。電車とバスの駅にも非常に近く（徒歩5～7分）、毎日清掃が行われ、部屋にタバコの臭いもありませんでした。非常におすすめです！コストパフォーマンスも抜群です。","","","Muay Arandyarak","","","","","","","","","","","",""
"","FALSE","Booking.com","10","2026-03-24","","Номер комфортный , чистый . Большая ванная . Есть достаточно места для двух больших чемоданов. Большой выбор блюд  на завтраках","","","部屋は快適で清潔です。バスルームも広く、大型スーツケース2個を置くのに十分なスペースがあります。朝食の種類も豊富です。","","Aleksandr","","","","","","","","","","","",""
"","FALSE","Booking.com","10","2026-03-24","","","","","","","江口","","","","","","","","","","","",""
"","FALSE","Trip.com","10","2026-03-23","酒店員工服務態度良好，房間乾淨企理。整體不錯。","","","ホテルのスタッフは親切で協力的で、部屋も清潔で整頓されていました。全体的に良いホテルです。","","","ゲ‍ス‍ト","","","","","","","","","","","",""
"","FALSE","Booking.com","9","2026-03-23","","部屋が広い、風呂が洗い場が別で、使い良い","無し","","部屋が広い、風呂が洗い場が別で、使い良い","無し","Seiichi","","","","","","","","","","","",""
"","FALSE","Booking.com","8","2026-03-23","","お風呂場が広くて快適だった。","特になし","","お風呂場が広くて快適だった。","特になし","H","","","","","","","","","","","",""
"","FALSE","Booking.com","9","2026-03-23","","","","","","","Kc","","","","","","","","","","","",""
